{
  "as_of": "2026-08-15T22:27:59.279013Z",
  "assessment": {
    "as_of": "2026-08-15T22:27:59.279013Z",
    "assessment_id": "readiness-e439fac24b50b93eee3b",
    "config_version": "2026.08.16-1",
    "criteria": [
      {
        "artifact_ids": [],
        "blocking_for": [
          "READY_FOR_PAPER",
          "READY_FOR_LIVE_REVIEW"
        ],
        "criterion_id": "TEST_SUITE_PASSES",
        "detail": "not collected: toolchain collectors were not requested for this run",
        "domain": "SOFTWARE_QUALITY",
        "evidence_age_seconds": null,
        "evidence_id": null,
        "evidence_kind": null,
        "evidence_source": null,
        "observed_at": null,
        "reason_code": "NOT_COLLECTED",
        "status": "NOT_TESTED",
        "title": "the offline test suite passes at this revision"
      },
      {
        "artifact_ids": [],
        "blocking_for": [
          "READY_FOR_PAPER",
          "READY_FOR_LIVE_REVIEW"
        ],
        "criterion_id": "LINT_CLEAN",
        "detail": "not collected: toolchain collectors were not requested for this run",
        "domain": "SOFTWARE_QUALITY",
        "evidence_age_seconds": null,
        "evidence_id": null,
        "evidence_kind": null,
        "evidence_source": null,
        "observed_at": null,
        "reason_code": "NOT_COLLECTED",
        "status": "NOT_TESTED",
        "title": "ruff reports no lint findings"
      },
      {
        "artifact_ids": [],
        "blocking_for": [
          "READY_FOR_PAPER",
          "READY_FOR_LIVE_REVIEW"
        ],
        "criterion_id": "FORMAT_CLEAN",
        "detail": "not collected: toolchain collectors were not requested for this run",
        "domain": "SOFTWARE_QUALITY",
        "evidence_age_seconds": null,
        "evidence_id": null,
        "evidence_kind": null,
        "evidence_source": null,
        "observed_at": null,
        "reason_code": "NOT_COLLECTED",
        "status": "NOT_TESTED",
        "title": "the tree is formatted"
      },
      {
        "artifact_ids": [],
        "blocking_for": [
          "READY_FOR_PAPER",
          "READY_FOR_LIVE_REVIEW"
        ],
        "criterion_id": "TYPECHECK_CLEAN",
        "detail": "not collected: toolchain collectors were not requested for this run",
        "domain": "SOFTWARE_QUALITY",
        "evidence_age_seconds": null,
        "evidence_id": null,
        "evidence_kind": null,
        "evidence_source": null,
        "observed_at": null,
        "reason_code": "NOT_COLLECTED",
        "status": "NOT_TESTED",
        "title": "mypy reports no type errors"
      },
      {
        "artifact_ids": [],
        "blocking_for": [
          "READY_FOR_PAPER",
          "READY_FOR_LIVE_REVIEW"
        ],
        "criterion_id": "CONFIGURATION_LOADS",
        "detail": "every configuration file loaded and cross-file invariants hold",
        "domain": "CONFIGURATION_SAFETY",
        "evidence_age_seconds": 0.0,
        "evidence_id": "evidence-f291b164db0455d505f5",
        "evidence_kind": "CONFIGURATION",
        "evidence_source": "Settings + config/",
        "observed_at": "2026-08-15T22:27:59.279013Z",
        "reason_code": "SATISFIED",
        "status": "PASS",
        "title": "the whole configuration tree loads and validates"
      },
      {
        "artifact_ids": [],
        "blocking_for": [
          "READY_FOR_PAPER",
          "READY_FOR_LIVE_REVIEW"
        ],
        "criterion_id": "TRADING_MODE_SAFE",
        "detail": "TRADING_MODE=PAPER",
        "domain": "CONFIGURATION_SAFETY",
        "evidence_age_seconds": 0.0,
        "evidence_id": "evidence-f291b164db0455d505f5",
        "evidence_kind": "CONFIGURATION",
        "evidence_source": "Settings + config/",
        "observed_at": "2026-08-15T22:27:59.279013Z",
        "reason_code": "SATISFIED",
        "status": "PASS",
        "title": "the trading mode is one readiness may be assessed from"
      },
      {
        "artifact_ids": [],
        "blocking_for": [
          "READY_FOR_PAPER",
          "READY_FOR_LIVE_REVIEW"
        ],
        "criterion_id": "LIVE_GUARDS_CONSISTENT",
        "detail": "TRADING_MODE=PAPER, live_trading_confirmed=False, checklist_signed_off=False",
        "domain": "CONFIGURATION_SAFETY",
        "evidence_age_seconds": 0.0,
        "evidence_id": "evidence-f291b164db0455d505f5",
        "evidence_kind": "CONFIGURATION",
        "evidence_source": "Settings + config/",
        "observed_at": "2026-08-15T22:27:59.279013Z",
        "reason_code": "SATISFIED",
        "status": "PASS",
        "title": "the live guards agree with the trading mode"
      },
      {
        "artifact_ids": [],
        "blocking_for": [
          "READY_FOR_PAPER",
          "READY_FOR_LIVE_REVIEW"
        ],
        "criterion_id": "EXECUTION_SWITCH_SAFE",
        "detail": "execution.enabled=true under TRADING_MODE=PAPER with explicit authorisation still required. An order additionally needs --confirm",
        "domain": "CONFIGURATION_SAFETY",
        "evidence_age_seconds": 0.0,
        "evidence_id": "evidence-f291b164db0455d505f5",
        "evidence_kind": "CONFIGURATION",
        "evidence_source": "Settings + config/",
        "observed_at": "2026-08-15T22:27:59.279013Z",
        "reason_code": "SATISFIED",
        "status": "PASS",
        "title": "execution.enabled is off, or on under an explicit paper policy"
      },
      {
        "artifact_ids": [],
        "blocking_for": [
          "READY_FOR_LIVE_REVIEW"
        ],
        "criterion_id": "BROKER_READ_ONLY",
        "detail": "IBKR_READ_ONLY=false. The connection can place orders. That is required for a deliberate paper submission and is not a state to sit in for live review",
        "domain": "CONFIGURATION_SAFETY",
        "evidence_age_seconds": 0.0,
        "evidence_id": "evidence-f291b164db0455d505f5",
        "evidence_kind": "CONFIGURATION",
        "evidence_source": "Settings + config/",
        "observed_at": "2026-08-15T22:27:59.279013Z",
        "reason_code": "BROKER_WRITABLE",
        "status": "FAIL",
        "title": "the broker connection is read-only"
      },
      {
        "artifact_ids": [],
        "blocking_for": [
          "READY_FOR_PAPER",
          "READY_FOR_LIVE_REVIEW"
        ],
        "criterion_id": "SUITE_RUNS_WITHOUT_GATEWAY",
        "detail": "the suite clamps the safety-critical environment and skips gateway-backed tests by default",
        "domain": "TEST_ISOLATION",
        "evidence_age_seconds": null,
        "evidence_id": "evidence-e123f75f35cb6eb066d6",
        "evidence_kind": "STORE_SCAN",
        "evidence_source": "tests/conftest.py",
        "observed_at": "2026-08-15T22:27:59.279013Z",
        "reason_code": "SATISFIED",
        "status": "PASS",
        "title": "an ordinary pytest needs no gateway, credentials or personal .env"
      },
      {
        "artifact_ids": [],
        "blocking_for": [
          "READY_FOR_PAPER",
          "READY_FOR_LIVE_REVIEW"
        ],
        "criterion_id": "LIVE_SUITES_GATED",
        "detail": "live, ibkr and llm markers are skipped without ALLOW_LIVE_TESTS",
        "domain": "TEST_ISOLATION",
        "evidence_age_seconds": null,
        "evidence_id": "evidence-e123f75f35cb6eb066d6",
        "evidence_kind": "STORE_SCAN",
        "evidence_source": "tests/conftest.py",
        "observed_at": "2026-08-15T22:27:59.279013Z",
        "reason_code": "SATISFIED",
        "status": "PASS",
        "title": "live and IBKR suites are skipped unless explicitly unlocked"
      },
      {
        "artifact_ids": [],
        "blocking_for": [
          "READY_FOR_PAPER",
          "READY_FOR_LIVE_REVIEW"
        ],
        "criterion_id": "PAPER_EXECUTION_SUITE_GATED",
        "detail": "paper_execution needs ALLOW_LIVE_TESTS and RUN_PAPER_EXECUTION_TESTS, checked independently",
        "domain": "TEST_ISOLATION",
        "evidence_age_seconds": null,
        "evidence_id": "evidence-e123f75f35cb6eb066d6",
        "evidence_kind": "STORE_SCAN",
        "evidence_source": "tests/conftest.py",
        "observed_at": "2026-08-15T22:27:59.279013Z",
        "reason_code": "SATISFIED",
        "status": "PASS",
        "title": "order-submitting suites need two separate unlocks"
      },
      {
        "artifact_ids": [],
        "blocking_for": [
          "READY_FOR_PAPER",
          "READY_FOR_LIVE_REVIEW"
        ],
        "criterion_id": "PAPER_BROKER_REACHABLE",
        "detail": "not collected: the broker probe was not requested for this run",
        "domain": "BROKER",
        "evidence_age_seconds": null,
        "evidence_id": null,
        "evidence_kind": null,
        "evidence_source": null,
        "observed_at": null,
        "reason_code": "NOT_COLLECTED",
        "status": "NOT_TESTED",
        "title": "the IBKR Paper gateway answers"
      },
      {
        "artifact_ids": [],
        "blocking_for": [
          "READY_FOR_PAPER",
          "READY_FOR_LIVE_REVIEW"
        ],
        "criterion_id": "ACCOUNT_READABLE",
        "detail": "not collected: the broker probe was not requested for this run",
        "domain": "BROKER",
        "evidence_age_seconds": null,
        "evidence_id": null,
        "evidence_kind": null,
        "evidence_source": null,
        "observed_at": null,
        "reason_code": "NOT_COLLECTED",
        "status": "NOT_TESTED",
        "title": "the account summary is readable"
      },
      {
        "artifact_ids": [],
        "blocking_for": [
          "READY_FOR_PAPER",
          "READY_FOR_LIVE_REVIEW"
        ],
        "criterion_id": "POSITIONS_READABLE",
        "detail": "not collected: the broker probe was not requested for this run",
        "domain": "BROKER",
        "evidence_age_seconds": null,
        "evidence_id": null,
        "evidence_kind": null,
        "evidence_source": null,
        "observed_at": null,
        "reason_code": "NOT_COLLECTED",
        "status": "NOT_TESTED",